case_id,target_id,symbol,company_name,market,case_type,canonical_archetype,posture,stage1_date,stage2_date,stage3_date,stage4b_date,stage4c_date,evidence_fields,red_flag_fields,alignment_hint,price_validation_status,production_input,notes
john_deere_autonomous_agri_ces_case,AGRI_MACHINERY_PRECISION_CYCLE,DE,John Deere autonomous agriculture CES case,US,success_candidate,AGRI_MACHINERY_PRECISION_CYCLE,WATCH_YELLOW_FIRST,2025-01-06,,,,,autonomous_tractor|precision_agriculture|labor_shortage_solution|software_attach_potential,farm_income|financing_cost|adoption_rate_unverified|right_to_repair,precision_agri_stage1_success_candidate,needs_price_backfill,false,"Autonomous agriculture technology is useful Stage 1 evidence, but sales, farmer ROI, and software attachment must verify it."
deere_farm_equipment_demand_slowdown_case,AGRI_MACHINERY_PRECISION_CYCLE,DE,Deere farm equipment demand slowdown,US,4c_thesis_break,AGRI_MACHINERY_PRECISION_CYCLE,WATCH_YELLOW_FIRST,2025-02-13,,,,2025-02-13,equipment_sales_decline|farm_income_weakness|high_borrowing_cost|revenue_decline,farm_income_weakness|high_borrowing_cost|equipment_sales_decline|tariff_uncertainty,agri_machinery_cycle_4c_watch,needs_price_backfill,false,Precision agriculture can be promising while the machinery company is still capped by farm-income and financing cycles.
deere_right_to_repair_settlement_case,AGRI_MACHINERY_SOFTWARE_LOCKIN,DE,Deere right-to-repair settlement,US,failed_rerating,AGRI_MACHINERY_SOFTWARE_LOCKIN,WATCH_YELLOW_FIRST,2026-04-01,,,,,right_to_repair_flag|repair_settlement_amount|software_lock_in|ftc_lawsuit_flag,right_to_repair_lawsuit|repair_monopoly_allegation|settlement_cost|ftc_lawsuit|customer_backlash,agri_machinery_software_lockin_regulatory_watch,needs_price_backfill,false,Software-enabled equipment lock-in can become a RedTeam risk if regulation or lawsuits weaken the model.
zoetis_bird_flu_vaccine_conditional_case,ANIMAL_HEALTH_BIOSECURITY,ZTS,Zoetis bird flu vaccine conditional clearance,US,success_candidate,ANIMAL_HEALTH_BIOSECURITY,WATCH_YELLOW_FIRST,2025-02-14,2025-02-14,,,,vaccine_conditional_approval|government_stockpile|biosecurity_demand,emergency_license|government_policy_uncertain|one_off_stockpile|trade_restriction,animal_health_event_to_contract_candidate,needs_price_backfill,false,"Conditional approval and stockpile rebuilding can move disease news toward Stage 2, but recurring use must be checked."
calmaine_egg_price_profit_case,AGRI_LIVESTOCK_FOOD_COMMODITY,CALM,Cal-Maine egg price profit cycle,US,cyclical_success,AGRI_LIVESTOCK_FOOD_COMMODITY,REDTEAM_FIRST,2025-04-09,2025-04-09,,2025-04-09,,egg_price_spike|avian_flu_supply_shock|op_profit_increase,price_normalization|disease_normalization|price_fixing_investigation,livestock_price_cyclical_success_regulatory_watch,needs_price_backfill,false,"Egg-price profit spikes can be real cyclical success, but price normalization and investigations cap Green."
bowery_vertical_farming_shutdown_case,VERTICAL_FARMING_UNIT_ECONOMICS,BOWERY_PRIVATE,Bowery vertical farming shutdown,US,4c_thesis_break,VERTICAL_FARMING_UNIT_ECONOMICS,REDTEAM_FIRST,2024-11-05,,,,2024-11-05,vertical_farming|shutdown|premium_pricing_failure|unit_economics_failure,unit_economics_failure|energy_cost|premium_pricing_failure|capex_burden,vertical_farming_unit_economics_4c,needs_price_backfill,false,Vertical farming can fail when consumers do not pay enough premium to cover energy and capex.
appharvest_chapter11_case,VERTICAL_FARMING_UNIT_ECONOMICS,APPH,AppHarvest Chapter 11,US,4c_thesis_break,VERTICAL_FARMING_UNIT_ECONOMICS,REDTEAM_FIRST,2023-07-24,,,,2023-07-24,vertical_farming|chapter11|greenhouse_sale,chapter11|capex_burden|unit_economics_failure|labor_or_safety_issue,smart_farm_spac_hard_4c,needs_price_backfill,false,Hydroponics and greenhouse capex without unit economics can become hard 4C.
duolingo_ai_strategy_bookings_miss_case,EDUCATION_SPECIALTY_SERVICES,DUOL,Duolingo AI strategy and softer bookings,US,4c_thesis_break,EDUCATION_SPECIALTY_SERVICES,WATCH_YELLOW_FIRST,2026-02-26,,,,2026-02-26,ai_speaking_feature|user_growth_priority|bookings_outlook_miss,bookings_miss|monetization_pressure|ai_cost,education_app_success_candidate_but_monetization_watch,needs_price_backfill,false,Education apps need bookings and monetization; AI features and user growth alone can still break the thesis.
chegg_ai_disruption_case,EDTECH_AI_DISRUPTION,CHGG,Chegg AI disruption,US,4c_thesis_break,EDTECH_AI_DISRUPTION,REDTEAM_FIRST,2023-05-02,,,,2023-05-02,ai_substitutes_core_service|traffic_decline|subscriber_decline,ai_disruption|traffic_decline|subscriber_decline|layoff|strategic_review,ai_education_disruption_hard_4c,needs_price_backfill,false,Education recurring revenue can break when AI substitutes the core service or search traffic channel.
2u_chapter11_case,ONLINE_EDUCATION_OPM_DISTRESS,TWOU,2U Chapter 11,US,4c_thesis_break,ONLINE_EDUCATION_OPM_DISTRESS,REDTEAM_FIRST,2024-07-25,,,,2024-07-25,online_education_platform|chapter11|debt_restructuring,chapter11|student_roi|debt|partner_concentration|regulatory_oversight,online_education_opm_hard_4c,needs_price_backfill,false,"Online education platforms need CAC, completion, student ROI, partner concentration, and debt checks."
coway_rental_recurring_case,HOME_LIVING_APPLIANCE_RENTAL,021240,Coway rental recurring service model,KR,success_candidate,HOME_LIVING_APPLIANCE_RENTAL,WATCH_YELLOW_FIRST,,,,,,rental_accounts|filter_service_revenue|care_service_revenue|overseas_accounts,rental_churn|competition|overseas_margin|quality_recall,recurring_home_service_candidate,needs_price_backfill,false,"Rental accounts and care services are stronger than one-time appliance sales, but churn and overseas margin remain required fields."
whirlpool_dividend_suspension_case,HOME_LIVING_APPLIANCE_RENTAL,WHR,Whirlpool dividend suspension and hardware cycle,US,4c_thesis_break,HOME_LIVING_APPLIANCE_RENTAL,WATCH_YELLOW_FIRST,2026-05-07,,,,2026-05-07,home_appliance_hardware|dividend_suspension|replacement_demand_collapse|guidance_cut,replacement_demand_collapse|dividend_suspension|housing_turnover_weakness|debt_reduction_pressure,home_appliance_hardware_cycle_4c,needs_price_backfill,false,Appliance hardware without recurring rental/care revenue remains exposed to housing and replacement cycles.
target_self_checkout_limit_case,SERVICE_KIOSK_SELF_CHECKOUT,TARGET_SELF_CHECKOUT,Target self-checkout item limit,US,failed_rerating,SERVICE_KIOSK_SELF_CHECKOUT,WATCH_YELLOW_FIRST,2024-03-16,,,,,self_checkout_rollout|self_checkout_limit|retailer_retreat|customer_friction,theft_shrink|customer_friction|retailer_retreat|employee_workload,kiosk_self_checkout_operational_counterexample,needs_price_backfill,false,"Self-checkout installation count is weak if theft, customer friction, and operational workload rise."
juul_fda_approval_case,CONSUMER_REGULATED_PRODUCT,JUUL_PRIVATE,Juul FDA tobacco and menthol e-cigarette approval,US,success_candidate,CONSUMER_REGULATED_PRODUCT,WATCH_YELLOW_FIRST,2025-07-17,2025-07-17,,,,fda_approval|sales_authorization|repeat_consumption|license_scope,youth_usage_controversy|policy_reversal|license_scope|public_health_warning,regulated_consumer_approval_stage2_candidate,needs_price_backfill,false,"Regulatory approval can change Stage materially, but scope, channels, social backlash, and reversal risk remain core checks."
fda_vape_enforcement_easing_case,NICOTINE_ALTERNATIVE_REGULATED,NICOTINE_POLICY_BASKET,FDA unauthorized vape enforcement easing,US,event_premium,NICOTINE_ALTERNATIVE_REGULATED,WATCH_YELLOW_FIRST,2026-05-08,,,2026-05-08,,fda_enforcement_easing|unauthorized_product_status|nicotine_pouch_or_vape_policy,unauthorized_product_status|enforcement_reversal|youth_usage_risk|public_health_warning,nicotine_alternative_regulatory_watch,needs_price_backfill,false,"Enforcement easing can route research, but it is not the same as durable authorization, channel access, and repeat FCF."
who_nicotine_pouch_youth_warning_case,NICOTINE_ALTERNATIVE_REGULATED,NICOTINE_PUBLIC_HEALTH,WHO nicotine pouch youth warning,GLOBAL,failed_rerating,NICOTINE_ALTERNATIVE_REGULATED,WATCH_YELLOW_FIRST,2026-05-15,,,,,public_health_warning|youth_usage_risk|nicotine_pouch_regulation,youth_usage_risk|public_health_warning|flavored_product_restriction|regulatory_backlash,nicotine_public_health_redteam,needs_price_backfill,false,Nicotine repeat consumption is not enough; youth usage and public-health warnings can cap or break the thesis.
cannabis_schedule3_limited_case,CANNABIS_REGULATED_PRODUCT,CANNABIS_POLICY_BASKET,Cannabis Schedule III limited rescheduling,US,event_premium,CANNABIS_REGULATED_PRODUCT,WATCH_YELLOW_FIRST,2026-05-12,,,2026-05-12,,dea_rescheduling|tax_effect_possible|regulated_product_policy,legal_conflict|license_scope|no_full_legalization|dea_registration_required,regulated_consumer_policy_stage1_watch,needs_price_backfill,false,"Rescheduling can help some operators, but it is not full legalization and remains a policy/event watch."
