stage_band,max_score,required_evidence,example_cases,green_policy,production_scoring_changed
Stage 1,45,disease_news|grain_or_fertilizer_price|medical_quota_policy|ai_education_news|kids_ip_viral|heated_tobacco_news|smart_farm_or_kiosk_theme,harim_manikar_livestock_disease_event_case|megastudy_medical_quota_policy_event_case,"Theme/news can route research, but it stays capped until repeat revenue, contract, price pass-through, regulatory scope, or OPM/FCF evidence appears.",false
Stage 2,70,government_policy_confirmed|actual_order_or_contract|regulated_distribution|repeat_enrollment|export_channel|price_path_confirmed|brand_or_ip_revenue_visible,pinkfong_ipo_stage2_4b_watch_case|ktng_lil_heated_tobacco_distribution_case,"Stage 2 can recognize price-path and visibility, but Stage 3 waits for unit economics and FCF conversion.",false
Stage 3,requires_5_of_8,repeat_revenue_or_repeat_contract|op_eps_revision_or_quarterly_op_beat|price_pass_through_faster_than_cost|demand_structural_not_event|stage2_60d_mfe_20pct|inventory_receivables_dealer_inventory_not_worse|no_regulatory_or_legal_hard_issue|valuation_not_overheated,ktng_possible_only_with_ngp_opm_fcf_and_regulation|pinkfong_possible_only_with_multi_ip_opm_fcf,"R12 Stage 3 is possible but strict: repeat revenue, unit economics, regulation, and FCF must be source-backed.",false
Stage 4B,requires_3_of_5,ipo_or_news_1d_20pct|narrative_rises_before_repeat_revenue|basket_indiscriminate_rally|op_eps_revision_lags_price|community_or_news_keyword_crowding,pinkfong_ipo_stage2_4b_watch_case|samsung_publishing_baby_shark_event_4b_watch_case,"Cool R12 price-path cases when IP, disease, policy, AI education, or fertilizer narratives move before durable earnings.",false
Stage 4C,hard_gate,legal_settlement_or_collusion|public_health_regulation_tightening|policy_reversal_or_cut|ai_substitutes_core_education_service|disease_normalization_or_price_drop|input_cost_overwhelms_price|one_hit_ip_revenue_slowdown|dealer_inventory_or_demand_slowdown|large_dilution_or_cash_burn,dongwon_starkist_settlement_legal_4c_watch_case|qanda_ai_tutor_disruption_overlay_case,"One hard legal, regulatory, policy, AI-disruption, disease-normalization, cost, IP, inventory, or dilution issue can block Green.",false
