stage_band,max_score,required_evidence,example_cases,green_policy,production_scoring_changed
Stage 1,45,hbm|ai_server|advanced_packaging|glass_substrate|cxl|on_device_ai|npu|adas|mlcc|pcb,on_device_ai_theme_korea_stage1_2_4b_watch_case,"Theme keywords route research only. Green is blocked before customer, shipment, revenue, OP/EPS, and price-path evidence.",false
Stage 2,70,customer_name|design_participation|process_adoption|government_grant|production_facility|strategic_investment|equipment_order|customer_capex,skc_absolics_glass_substrate_stage2_case|gaonchips_pfn_samsung_2nm_stage2_case,"Stage 2 can be strong, but Stage 3 waits for order size, shipment, yield, revenue, and OP/EPS conversion.",false
Stage 3,requires_5_of_8,customer_amount_period_or_order_size|shipment_or_mass_production_schedule|op_eps_revision_or_op_beat|customer_diversification_or_repeat_order|60d_mfe_20pct_after_stage2|relative_strength_vs_market|no_ip_labor_production_hard_issue|valuation_not_overheated,hbm_test_equipment_basket_stage3_candidate_case|ai_server_pcb_mlcc_second_wave_stage3_candidate_case,"Stage 3 early catch is possible only when earnings conversion, customer/order detail, production evidence, price path, and RedTeam align.",false
Stage 4B,requires_4_of_6,stage2_120d_mfe_80pct|basket_rally_without_contract_detail|price_faster_than_op_eps_revision|crowded_ai_hbm_glass_npu_keywords|peer_top_quartile_valuation|media_mou_design_win_only_price_rally,on_device_ai_theme_korea_stage1_2_4b_watch_case,"Good narratives are cooled when price and keyword crowding outrun order, shipment, yield, and revision evidence.",false
Stage 4C,hard_gate,customer_contract_cancel_or_correction|order_size_customer_undisclosed_price_only_rally|mass_production_delay_or_yield_failure|customer_capex_delay|labor_or_production_disruption|ip_leak_or_china_catchup|accounting_audit_disclosure_issue|large_cb_bw_or_dilution,samsung_supply_chain_labor_disruption_4c_case|korea_memory_ip_leak_cxmt_4c_case,"A single hard IP, labor, production, disclosure, customer CAPEX, or dilution issue can block Green.",false
