cap_id,max_stage,condition,example,production_scoring_changed
stage1_science_tam_capacity_cap,Stage 1,"clinical result, FDA/EMA expectation, medical AI paper, CDMO capacity, GLP-1 TAM, biosimilar approval expectation, or device launch only","Pre-revenue biotech, AI drug platform, medical-AI AUC paper, or GLP-1 TAM headline.",false
stage2_approval_access_validation_cap,Stage 2,"approval, PBM/formulary, contract or facility acquisition, procedure growth, external validation, pricing, launch plan, or initial stock reaction","Lilly Foundayo approval, Samsung Biologics Rockville facility, Cigna Humira biosimilar $0 copay, or Lunit DBT validation.",false
stage3_commercial_revenue_required,Stage 3 candidate,"prescriptions, insurance/reimbursement, commercial revenue, OPM/FCF, procedure growth plus consumables, repeat CDMO contracts, utilization, and aligned price path",Intuitive Surgical procedure growth plus instruments/accessories revenue and guidance raise.,false
stage4b_healthcare_consensus_crowding,4B-watch,"GLP-1, surgical robot, CDMO, medical AI, or biosimilar consensus is crowded and valuation moves before scripts or FCF","GLP-1 mega-TAM or medtech platform premium before gross-to-net, scripts, procedure mix, and FCF remain confirmed.",false
stage4c_healthcare_hard_redteam,4C,"sales/profit decline warning, price war, compounded crackdown, cash crunch, discounted take-private, forecast cut, impairment, patent litigation, counterfeit or safety warning","Novo price-war warning, Hims compounded GLP-1 crackdown, bluebird cash crunch, Charles River forecast cut, Teladoc impairment, or Botox counterfeit warning.",false
